{
  "confidence": 0.4,
  "font": {
    "ascent": 800,
    "descent": 200,
    "upm": 1000
  },
  "glyphs": {
    "g-row01-col01-v01": {
      "advance_width": 597,
      "canonical_name": "aleph",
      "confidence": 0.45,
      "rationale": "Common source-scale transformation preserves relative proportions",
      "scale": 4.7272727272727275,
      "translate_x": 60,
      "translate_y": 100
    },
    "g-row01-col02-v01": {
      "advance_width": 872,
      "canonical_name": "bet",
      "confidence": 0.45,
      "rationale": "Common source-scale transformation preserves relative proportions",
      "scale": 4.7272727272727275,
      "translate_x": 60,
      "translate_y": 100
    },
    "g-row01-col03-v01": {
      "advance_width": 872,
      "canonical_name": "gimel",
      "confidence": 0.45,
      "rationale": "Common source-scale transformation preserves relative proportions",
      "scale": 4.7272727272727275,
      "translate_x": 60,
      "translate_y": 100
    },
    "g-row01-col04-v01": {
      "advance_width": 1051,
      "canonical_name": "dalet",
      "confidence": 0.45,
      "rationale": "Common source-scale transformation preserves relative proportions",
      "scale": 4.7272727272727275,
      "translate_x": 60,
      "translate_y": 100
    },
    "g-row01-col05-v01": {
      "advance_width": 872,
      "canonical_name": "he",
      "confidence": 0.45,
      "rationale": "Common source-scale transformation preserves relative proportions",
      "scale": 4.7272727272727275,
      "translate_x": 60,
      "translate_y": 100
    },
    "g-row01-col06-v01": {
      "advance_width": 872,
      "canonical_name": "waw",
      "confidence": 0.45,
      "rationale": "Common source-scale transformation preserves relative proportions",
      "scale": 4.7272727272727275,
      "translate_x": 60,
      "translate_y": 100
    },
    "g-row01-col07-v01": {
      "advance_width": 560,
      "canonical_name": "zayin",
      "confidence": 0.45,
      "rationale": "Common source-scale transformation preserves relative proportions",
      "scale": 4.7272727272727275,
      "translate_x": 60,
      "translate_y": 100
    },
    "g-row01-col08-v01": {
      "advance_width": 621,
      "canonical_name": "het",
      "confidence": 0.45,
      "rationale": "Common source-scale transformation preserves relative proportions",
      "scale": 4.7272727272727275,
      "translate_x": 60,
      "translate_y": 100
    },
    "g-row01-col09-v01": {
      "advance_width": 569,
      "canonical_name": "tet",
      "confidence": 0.45,
      "rationale": "Common source-scale transformation preserves relative proportions",
      "scale": 4.7272727272727275,
      "translate_x": 60,
      "translate_y": 100
    },
    "g-row01-col10-v01": {
      "advance_width": 588,
      "canonical_name": "yod",
      "confidence": 0.45,
      "rationale": "Common source-scale transformation preserves relative proportions",
      "scale": 4.7272727272727275,
      "translate_x": 60,
      "translate_y": 100
    },
    "g-row01-col11-v01": {
      "advance_width": 531,
      "canonical_name": "kaf",
      "confidence": 0.45,
      "rationale": "Common source-scale transformation preserves relative proportions",
      "scale": 4.7272727272727275,
      "translate_x": 60,
      "translate_y": 100
    },
    "g-row01-col12-v01": {
      "advance_width": 782,
      "canonical_name": "lamed",
      "confidence": 0.45,
      "rationale": "Common source-scale transformation preserves relative proportions",
      "scale": 4.7272727272727275,
      "translate_x": 60,
      "translate_y": 100
    },
    "g-row01-col13-v01": {
      "advance_width": 872,
      "canonical_name": "mem",
      "confidence": 0.45,
      "rationale": "Common source-scale transformation preserves relative proportions",
      "scale": 4.7272727272727275,
      "translate_x": 60,
      "translate_y": 100
    },
    "g-row01-col14-v01": {
      "advance_width": 872,
      "canonical_name": "nun",
      "confidence": 0.45,
      "rationale": "Common source-scale transformation preserves relative proportions",
      "scale": 4.7272727272727275,
      "translate_x": 60,
      "translate_y": 100
    },
    "g-row01-col15-v01": {
      "advance_width": 872,
      "canonical_name": "samekh",
      "confidence": 0.45,
      "rationale": "Common source-scale transformation preserves relative proportions",
      "scale": 4.7272727272727275,
      "translate_x": 60,
      "translate_y": 100
    },
    "g-row01-col16-v01": {
      "advance_width": 1051,
      "canonical_name": "ayin",
      "confidence": 0.45,
      "rationale": "Common source-scale transformation preserves relative proportions",
      "scale": 4.7272727272727275,
      "translate_x": 60,
      "translate_y": 100
    },
    "g-row01-col17-v01": {
      "advance_width": 872,
      "canonical_name": "pe",
      "confidence": 0.45,
      "rationale": "Common source-scale transformation preserves relative proportions",
      "scale": 4.7272727272727275,
      "translate_x": 60,
      "translate_y": 100
    },
    "g-row01-col18-v01": {
      "advance_width": 597,
      "canonical_name": "tsade",
      "confidence": 0.45,
      "rationale": "Common source-scale transformation preserves relative proportions",
      "scale": 4.7272727272727275,
      "translate_x": 60,
      "translate_y": 100
    },
    "g-row01-col19-v01": {
      "advance_width": 579,
      "canonical_name": "qof",
      "confidence": 0.45,
      "rationale": "Common source-scale transformation preserves relative proportions",
      "scale": 4.7272727272727275,
      "translate_x": 60,
      "translate_y": 100
    },
    "g-row01-col20-v01": {
      "advance_width": 579,
      "canonical_name": "resh",
      "confidence": 0.45,
      "rationale": "Common source-scale transformation preserves relative proportions",
      "scale": 4.7272727272727275,
      "translate_x": 60,
      "translate_y": 100
    },
    "g-row01-col21-v01": {
      "advance_width": 640,
      "canonical_name": "shin",
      "confidence": 0.45,
      "rationale": "Common source-scale transformation preserves relative proportions",
      "scale": 4.7272727272727275,
      "translate_x": 60,
      "translate_y": 100
    },
    "g-row01-col22-v01": {
      "advance_width": 550,
      "canonical_name": "taw",
      "confidence": 0.45,
      "rationale": "Common source-scale transformation preserves relative proportions",
      "scale": 4.7272727272727275,
      "translate_x": 60,
      "translate_y": 100
    }
  },
  "rationale": "Deterministic common scale; no per-glyph beautification"
}
